{"schemaVersion":1,"productId":"sample-qr-inventory","slug":"sample-qr-inventory","name":"[サンプル] QR収納メモ","brand":"Sample Cloud","kind":"app","categoryIds":["home","web-app","free"],"problemTagIds":["forgetting","cleaning"],"problemSolved":"しまった場所を後から思い出せない手間を減らす","convenienceInOneSentence":"箱ごとの中身メモをQRからすぐ開けるようにする。","whyInteresting":"収納を透明にするのではなく、見えない箱へ検索できる入口を付ける考え方。","whoFor":["季節物を箱で保管する人"],"whoCanSkip":["収納箱が少なく中身を覚えている人"],"tradeoffs":["初回登録の手間は必要"],"officialUrl":"https://example.com/sample-qr-inventory","media":[],"pricing":{"display":null,"currency":"JPY","verifiedAt":null},"availability":"available","scores":{"discoverySurprise":72,"practicalUtility":80,"clarity":88,"evidenceStrength":55,"audienceFit":82,"valueSense":75,"distinctiveness":70,"shareability":68,"risk":12},"routes":[{"routeId":"sample-qr-inventory-official","provider":"direct","merchant":"Sample official","url":"https://example.com/sample-qr-inventory","routeType":"official","platforms":["hub"],"status":"ACTIVE","destinationProductMatch":true,"verifiedAt":"2026-08-14T06:00:00.000Z","disclosureRequired":false,"notes":"Sample-only route; not a real commercial destination."}],"alternatives":[],"social":[],"freshness":{"lastProductVerifiedAt":"2026-08-14T06:00:00.000Z","lastPriceVerifiedAt":null,"lastAffiliateRouteVerifiedAt":"2026-08-14T06:00:00.000Z"},"publication":{"status":"published","firstPublishedAt":"2026-08-01T00:00:00.000Z","updatedAt":"2026-08-12T00:00:00.000Z"}}
