{"schemaVersion":1,"productId":"sample-folding-stand","slug":"sample-folding-stand","name":"[サンプル] 超薄型折りたたみPCスタンド","brand":"Sample Desk","kind":"physical","categoryIds":["work","travel","gadget"],"problemTagIds":["business-trip","small-bag","pc-speed"],"problemSolved":"出先でノートPCの高さを確保するため別の大きな台を持つ手間を減らす","convenienceInOneSentence":"薄く畳んで持ち歩き、必要な時だけ画面位置を上げられる。","whyInteresting":"机上用品を持ち運び道具に変える発想で、出張との相性が分かりやすい。","whoFor":["外出先で長くPC作業する人"],"whoCanSkip":["外ではPCをほぼ使わない人"],"tradeoffs":["角度によっては外付けキーボードが欲しくなる"],"officialUrl":"https://example.com/sample-folding-stand","media":[],"pricing":{"display":null,"currency":"JPY","verifiedAt":null},"availability":"available","scores":{"discoverySurprise":74,"practicalUtility":80,"clarity":88,"evidenceStrength":55,"audienceFit":82,"valueSense":75,"distinctiveness":70,"shareability":68,"risk":12},"routes":[{"routeId":"sample-folding-stand-official","provider":"direct","merchant":"Sample official","url":"https://example.com/sample-folding-stand","routeType":"official","platforms":["hub"],"status":"ACTIVE","destinationProductMatch":true,"verifiedAt":"2026-08-14T06:00:00.000Z","disclosureRequired":false,"notes":"Sample-only route; not a real commercial destination."}],"alternatives":[],"social":[],"freshness":{"lastProductVerifiedAt":"2026-08-14T06:00:00.000Z","lastPriceVerifiedAt":null,"lastAffiliateRouteVerifiedAt":"2026-08-14T06:00:00.000Z"},"publication":{"status":"published","firstPublishedAt":"2026-08-01T00:00:00.000Z","updatedAt":"2026-08-10T00:00:00.000Z"}}
