{"schemaVersion":1,"productId":"sample-magnetic-cable-dock","slug":"sample-magnetic-cable-dock","name":"[サンプル] マグネット式ケーブルドック","brand":"Sample Works","kind":"physical","categoryIds":["work","gadget","low-cost"],"problemTagIds":["cable-clutter","pc-speed"],"problemSolved":"充電ケーブルが机の裏へ落ちる手間を減らす","convenienceInOneSentence":"使っていない充電ケーブルを机の端に定位置固定できる。","whyInteresting":"置き場所を作るだけの小さな道具なのに、毎回ケーブルを拾う動作を消せるのが面白い。","whoFor":["机からケーブルがよく落ちる人","複数の充電線を使い分ける人"],"whoCanSkip":["ワイヤレス充電だけで完結する人"],"tradeoffs":["ケーブル径によっては保持力が合わないことがある"],"officialUrl":"https://example.com/sample-magnetic-cable-dock","media":[],"pricing":{"display":null,"currency":"JPY","verifiedAt":null},"availability":"available","scores":{"discoverySurprise":72,"practicalUtility":80,"clarity":88,"evidenceStrength":55,"audienceFit":82,"valueSense":75,"distinctiveness":70,"shareability":68,"risk":12},"routes":[{"routeId":"sample-magnetic-cable-dock-official","provider":"direct","merchant":"Sample official","url":"https://example.com/sample-magnetic-cable-dock","routeType":"official","platforms":["hub"],"status":"ACTIVE","destinationProductMatch":true,"verifiedAt":"2026-08-14T06:00:00.000Z","disclosureRequired":false,"notes":"Sample-only route; not a real commercial destination."}],"alternatives":[],"social":[],"freshness":{"lastProductVerifiedAt":"2026-08-14T06:00:00.000Z","lastPriceVerifiedAt":null,"lastAffiliateRouteVerifiedAt":"2026-08-14T06:00:00.000Z"},"publication":{"status":"published","firstPublishedAt":"2026-08-01T00:00:00.000Z","updatedAt":"2026-08-04T00:00:00.000Z"}}
