{"schemaVersion":1,"productId":"sample-legacy-travel-adapter","slug":"sample-legacy-travel-adapter","name":"[サンプル] 旧型ミニ変換アダプター","brand":"Sample Legacy","kind":"physical","categoryIds":["travel","gadget"],"problemTagIds":["business-trip","small-bag"],"problemSolved":"複数の小さな変換部品を持ち分ける手間を減らす","convenienceInOneSentence":"一つのケースに複数形式をまとめる。","whyInteresting":"終了商品の履歴ページと代替導線を検証するためのサンプル。","whoFor":["過去のSNSリンクから情報を確認したい人"],"whoCanSkip":["現在購入できる商品だけを見たい人"],"tradeoffs":["このサンプルは提供終了状態を検証するための架空データ"],"officialUrl":"https://example.com/sample-legacy-travel-adapter","media":[],"pricing":{"display":null,"currency":"JPY","verifiedAt":null},"availability":"discontinued","scores":{"discoverySurprise":73,"practicalUtility":80,"clarity":88,"evidenceStrength":55,"audienceFit":82,"valueSense":75,"distinctiveness":70,"shareability":68,"risk":12},"routes":[],"alternatives":[{"productId":"sample-packing-cube","relation":"current-alternative","reason":"同じ『荷物を小さくする』方向で現在掲載中の別サンプル。","verifiedAt":"2026-08-14T06:00:00.000Z"}],"social":[],"freshness":{"lastProductVerifiedAt":"2026-08-14T06:00:00.000Z","lastPriceVerifiedAt":null,"lastAffiliateRouteVerifiedAt":null},"publication":{"status":"archived","firstPublishedAt":"2026-08-01T00:00:00.000Z","updatedAt":"2026-08-13T00:00:00.000Z"}}
