{"schemaVersion":1,"productId":"sample-laundry-sorter","slug":"sample-laundry-sorter","name":"[サンプル] 分別ポケット付きランドリーバッグ","brand":"Sample Home","kind":"physical","categoryIds":["home","low-cost"],"problemTagIds":["laundry"],"problemSolved":"洗濯前に衣類を分け直す手間を減らす","convenienceInOneSentence":"入れる時点で種類を分け、洗う時の仕分け作業を短くする。","whyInteresting":"洗濯機の前でまとめて分類するのではなく、日常動作の中へ分散できる。","whoFor":["洗濯物を色や素材で分ける家庭"],"whoCanSkip":["全部まとめて洗う人"],"tradeoffs":["設置スペースが通常のバッグより必要"],"officialUrl":"https://example.com/sample-laundry-sorter","media":[],"pricing":{"display":null,"currency":"JPY","verifiedAt":null},"availability":"available","scores":{"discoverySurprise":75,"practicalUtility":80,"clarity":88,"evidenceStrength":55,"audienceFit":82,"valueSense":75,"distinctiveness":70,"shareability":68,"risk":12},"routes":[{"routeId":"sample-laundry-sorter-official","provider":"direct","merchant":"Sample official","url":"https://example.com/sample-laundry-sorter","routeType":"official","platforms":["hub"],"status":"ACTIVE","destinationProductMatch":true,"verifiedAt":"2026-08-14T06:00:00.000Z","disclosureRequired":false,"notes":"Sample-only route; not a real commercial destination."}],"alternatives":[],"social":[],"freshness":{"lastProductVerifiedAt":"2026-08-14T06:00:00.000Z","lastPriceVerifiedAt":null,"lastAffiliateRouteVerifiedAt":"2026-08-14T06:00:00.000Z"},"publication":{"status":"published","firstPublishedAt":"2026-08-01T00:00:00.000Z","updatedAt":"2026-08-07T00:00:00.000Z"}}
