{"schemaVersion":1,"productId":"sample-measuring-bottle","slug":"sample-measuring-bottle","name":"[サンプル] 目盛り一体型調味ボトル","brand":"Sample Kitchen","kind":"physical","categoryIds":["home","low-cost"],"problemTagIds":["cooking"],"problemSolved":"毎回計量スプーンを出して洗う手間を減らす","convenienceInOneSentence":"ボトル側の目盛りを見ながら必要量を出せる。","whyInteresting":"調味料の計量と容器を一体化して、洗い物を一つ減らす発想。","whoFor":["決まった量をよく使う人"],"whoCanSkip":["目分量だけで料理する人"],"tradeoffs":["粘度の高い調味料では目盛りどおり出にくい場合がある"],"officialUrl":"https://example.com/sample-measuring-bottle","media":[],"pricing":{"display":null,"currency":"JPY","verifiedAt":null},"availability":"available","scores":{"discoverySurprise":72,"practicalUtility":80,"clarity":88,"evidenceStrength":55,"audienceFit":82,"valueSense":75,"distinctiveness":70,"shareability":68,"risk":12},"routes":[{"routeId":"sample-measuring-bottle-official","provider":"direct","merchant":"Sample official","url":"https://example.com/sample-measuring-bottle","routeType":"official","platforms":["hub"],"status":"ACTIVE","destinationProductMatch":true,"verifiedAt":"2026-08-14T06:00:00.000Z","disclosureRequired":false,"notes":"Sample-only route; not a real commercial destination."}],"alternatives":[],"social":[],"freshness":{"lastProductVerifiedAt":"2026-08-14T06:00:00.000Z","lastPriceVerifiedAt":null,"lastAffiliateRouteVerifiedAt":"2026-08-14T06:00:00.000Z"},"publication":{"status":"published","firstPublishedAt":"2026-08-01T00:00:00.000Z","updatedAt":"2026-08-08T00:00:00.000Z"}}
