{"schemaVersion":1,"productId":"sample-key-reminder","slug":"sample-key-reminder","name":"[サンプル] 玄関チェックタグ","brand":"Sample Life","kind":"physical","categoryIds":["home","unusual"],"problemTagIds":["forgetting"],"problemSolved":"家を出た後に持ち物を思い出す不安を減らす","convenienceInOneSentence":"玄関で必要品を物理タグとして一度確認する習慣を作れる。","whyInteresting":"アプリ通知ではなく、目に入る位置へ確認行動を置くシンプルさが特徴。","whoFor":["忘れ物が気になる人","スマホ通知を見逃しやすい人"],"whoCanSkip":["チェック習慣が不要な人"],"tradeoffs":["タグ自体を見ない習慣になると効果が薄れる"],"officialUrl":"https://example.com/sample-key-reminder","media":[],"pricing":{"display":null,"currency":"JPY","verifiedAt":null},"availability":"available","scores":{"discoverySurprise":73,"practicalUtility":80,"clarity":88,"evidenceStrength":55,"audienceFit":82,"valueSense":75,"distinctiveness":70,"shareability":68,"risk":12},"routes":[{"routeId":"sample-key-reminder-official","provider":"direct","merchant":"Sample official","url":"https://example.com/sample-key-reminder","routeType":"official","platforms":["hub"],"status":"ACTIVE","destinationProductMatch":true,"verifiedAt":"2026-08-14T06:00:00.000Z","disclosureRequired":false,"notes":"Sample-only route; not a real commercial destination."}],"alternatives":[],"social":[],"freshness":{"lastProductVerifiedAt":"2026-08-14T06:00:00.000Z","lastPriceVerifiedAt":null,"lastAffiliateRouteVerifiedAt":"2026-08-14T06:00:00.000Z"},"publication":{"status":"published","firstPublishedAt":"2026-08-01T00:00:00.000Z","updatedAt":"2026-08-09T00:00:00.000Z"}}
