{"schemaVersion":1,"productId":"sample-browser-snippet","slug":"sample-browser-snippet","name":"[サンプル] 定型文スニペットWebツール","brand":"Sample Cloud","kind":"free-tool","categoryIds":["work","web-app","free"],"problemTagIds":["pc-speed","forgetting"],"problemSolved":"同じ文章を何度も打ち直す手間を減らす","convenienceInOneSentence":"よく使う文章を短い呼び出し名からすぐ貼り付けられる。","whyInteresting":"文章そのものをAIに任せず、決めた定型文を確実に再利用するだけなので用途が明快。","whoFor":["問い合わせ返信が多い人","住所や案内文を繰り返し使う人"],"whoCanSkip":["毎回文章を変えたい人"],"tradeoffs":["共有端末では機密文を登録しない方がよい"],"officialUrl":"https://example.com/sample-browser-snippet","media":[],"pricing":{"display":null,"currency":"JPY","verifiedAt":null},"availability":"available","scores":{"discoverySurprise":74,"practicalUtility":80,"clarity":88,"evidenceStrength":55,"audienceFit":82,"valueSense":75,"distinctiveness":70,"shareability":68,"risk":12},"routes":[{"routeId":"sample-browser-snippet-official","provider":"direct","merchant":"Sample official","url":"https://example.com/sample-browser-snippet","routeType":"official","platforms":["hub"],"status":"ACTIVE","destinationProductMatch":true,"verifiedAt":"2026-08-14T06:00:00.000Z","disclosureRequired":false,"notes":"Sample-only route; not a real commercial destination."}],"alternatives":[],"social":[],"freshness":{"lastProductVerifiedAt":"2026-08-14T06:00:00.000Z","lastPriceVerifiedAt":null,"lastAffiliateRouteVerifiedAt":"2026-08-14T06:00:00.000Z"},"publication":{"status":"published","firstPublishedAt":"2026-08-01T00:00:00.000Z","updatedAt":"2026-08-06T00:00:00.000Z"}}
