{"schemaVersion":1,"productId":"sample-drain-catcher","slug":"sample-drain-catcher","name":"[サンプル] 交換式排水口キャッチャー","brand":"Sample Clean","kind":"physical","categoryIds":["home","low-cost"],"problemTagIds":["cleaning"],"problemSolved":"排水口に絡んだゴミを直接触って掃除する手間を減らす","convenienceInOneSentence":"汚れを交換部へ集め、掃除を取り替え作業に近づける。","whyInteresting":"掃除性能を上げるより、触りたくない作業そのものを別の動作へ置き換える。","whoFor":["排水口掃除が苦手な人"],"whoCanSkip":["使い捨て部品を増やしたくない人"],"tradeoffs":["継続的に交換部材が必要"],"officialUrl":"https://example.com/sample-drain-catcher","media":[],"pricing":{"display":null,"currency":"JPY","verifiedAt":null},"availability":"available","scores":{"discoverySurprise":75,"practicalUtility":80,"clarity":88,"evidenceStrength":55,"audienceFit":82,"valueSense":75,"distinctiveness":70,"shareability":68,"risk":12},"routes":[{"routeId":"sample-drain-catcher-official","provider":"direct","merchant":"Sample official","url":"https://example.com/sample-drain-catcher","routeType":"official","platforms":["hub"],"status":"ACTIVE","destinationProductMatch":true,"verifiedAt":"2026-08-14T06:00:00.000Z","disclosureRequired":false,"notes":"Sample-only route; not a real commercial destination."}],"alternatives":[],"social":[],"freshness":{"lastProductVerifiedAt":"2026-08-14T06:00:00.000Z","lastPriceVerifiedAt":null,"lastAffiliateRouteVerifiedAt":"2026-08-14T06:00:00.000Z"},"publication":{"status":"published","firstPublishedAt":"2026-08-01T00:00:00.000Z","updatedAt":"2026-08-11T00:00:00.000Z"}}
