{"schemaVersion":1,"productId":"sample-packing-cube","slug":"sample-packing-cube","name":"[サンプル] 圧縮できる衣類ポーチ","brand":"Sample Travel","kind":"physical","categoryIds":["travel"],"problemTagIds":["business-trip","small-bag"],"problemSolved":"衣類がかさばってバッグが膨らむ面倒を減らす","convenienceInOneSentence":"ファスナー操作だけで衣類の体積をまとめやすくする。","whyInteresting":"機械を使わず、荷造りの流れのまま圧縮できる点が分かりやすい。","whoFor":["出張で衣類を持ち歩く人","帰りに荷物が増えやすい人"],"whoCanSkip":["そもそも衣類が少ない日帰り移動"],"tradeoffs":["詰めすぎるとシワが増える場合がある"],"officialUrl":"https://example.com/sample-packing-cube","media":[],"pricing":{"display":null,"currency":"JPY","verifiedAt":null},"availability":"available","scores":{"discoverySurprise":73,"practicalUtility":80,"clarity":88,"evidenceStrength":55,"audienceFit":82,"valueSense":75,"distinctiveness":70,"shareability":68,"risk":12},"routes":[{"routeId":"sample-packing-cube-official","provider":"direct","merchant":"Sample official","url":"https://example.com/sample-packing-cube","routeType":"official","platforms":["hub"],"status":"ACTIVE","destinationProductMatch":true,"verifiedAt":"2026-08-14T06:00:00.000Z","disclosureRequired":false,"notes":"Sample-only route; not a real commercial destination."}],"alternatives":[],"social":[],"freshness":{"lastProductVerifiedAt":"2026-08-14T06:00:00.000Z","lastPriceVerifiedAt":null,"lastAffiliateRouteVerifiedAt":"2026-08-14T06:00:00.000Z"},"publication":{"status":"published","firstPublishedAt":"2026-08-01T00:00:00.000Z","updatedAt":"2026-08-05T00:00:00.000Z"}}
